{
  "contract_version": "domainry-eval-freeze-manifest-v1",
  "run_id": "m1-crm-v0.3.6-25-m1-report-kind-20260905-598bd7ee7b39-baseline-10",
  "benchmark": "m1-crm",
  "run_kind": "baseline",
  "parent_run_id": null,
  "model": "gpt-5.6-sol",
  "budgets": {
    "wall_clock_seconds": 3600.0,
    "total_tokens": 5000000,
    "cli_invocations": 40,
    "cli_retries": 0
  },
  "absence_proof": {
    "checked_epoch": 1788587670.91907,
    "isolation_root_absent": true,
    "project_absent": true,
    "codex_home_absent": true,
    "agent_home_absent": true,
    "sqlite_database_absent": true,
    "sqlite_wal_absent": true,
    "sqlite_shm_absent": true
  },
  "isolation": {
    "root": "/private/tmp/domainry-m1-v25-report-kind-baseline-10",
    "codex_home": "/private/tmp/domainry-m1-v25-report-kind-baseline-10/codex-home",
    "agent_home": "/private/tmp/domainry-m1-v25-report-kind-baseline-10/home",
    "temp": "/private/tmp/domainry-m1-v25-report-kind-baseline-10/tmp",
    "project": "/private/tmp/domainry-m1-v25-report-kind-baseline-10/project",
    "runtime": "/private/tmp/domainry-m1-v25-report-kind-baseline-10/runtime",
    "database": "/private/tmp/domainry-m1-v25-report-kind-baseline-10/runtime/cohort.sqlite",
    "candidate_copy": "/private/tmp/domainry-m1-v25-report-kind-baseline-10/codex-home/skills/domainry-builder-v1"
  },
  "candidate": {
    "candidate_id": "v0.3.6-25-m1-report-kind-20260905+598bd7ee7b39",
    "skill_name": "domainry-builder-v1",
    "skill_version": "v0.3.6-25-m1-report-kind-20260905",
    "skill_identity_sha256": "ebd64d96025aeabc3ec803e2cef1d6330e670533269edbfc0dda8172909aaceb",
    "package_metadata_sha256": "1eb3b204522f5e0a7ceaff57d95d291801a9a44cd658d04bfebc131e43386300",
    "skill_tree_sha256": "598bd7ee7b3957b0447918bf7f099abcd643bfb3ddf7b4c530b72770ae032b16",
    "cli_binary_sha256": "fe69aaac0ac44e759746125502dc58c9482f6868c500114fbdcddd717815bd81",
    "runtime_api_contract_version": "runtime-domain-api-v1",
    "runtime_api_contract_hash": "4fe655cbfd4fa0bc0b0c04c89b86926fc6aceb059c9fccf5b09eec9b459330f7",
    "apply_target_flag": "--service",
    "apply_target_value": "http://127.0.0.1:8283"
  },
  "isolated_candidate": {
    "candidate_id": "v0.3.6-25-m1-report-kind-20260905+598bd7ee7b39",
    "skill_name": "domainry-builder-v1",
    "skill_version": "v0.3.6-25-m1-report-kind-20260905",
    "skill_identity_sha256": "ebd64d96025aeabc3ec803e2cef1d6330e670533269edbfc0dda8172909aaceb",
    "package_metadata_sha256": "1eb3b204522f5e0a7ceaff57d95d291801a9a44cd658d04bfebc131e43386300",
    "skill_tree_sha256": "598bd7ee7b3957b0447918bf7f099abcd643bfb3ddf7b4c530b72770ae032b16",
    "cli_binary_sha256": "fe69aaac0ac44e759746125502dc58c9482f6868c500114fbdcddd717815bd81",
    "runtime_api_contract_version": "runtime-domain-api-v1",
    "runtime_api_contract_hash": "4fe655cbfd4fa0bc0b0c04c89b86926fc6aceb059c9fccf5b09eec9b459330f7",
    "apply_target_flag": "--service",
    "apply_target_value": "http://127.0.0.1:8283"
  },
  "service_identity": {
    "target_kind": "service",
    "healthy": true,
    "http_status": 200,
    "health_document_sha256": "714f6796a7e31470461e11beb066a6cfee74d125a7188834adbe28e72c7981b0",
    "published_identity": {
      "contract_version": "domainry-control-plane-health-v1",
      "discovery": "/.well-known/domainry-plane",
      "service_kind": "template-control-plane",
      "version": "v0.3.6-25-m1-report-kind-20260905",
      "checks": [
        {
          "detail": "v0.3.6-25-m1-report-kind-20260905",
          "name": "application_delivery",
          "status": "passed"
        },
        {
          "detail": "domainry-frontend-product_v0.3.6-25-m1-report-kind-20260905.tar.gz sha256:cdf4842f3c0e782a90376d2431a7126e5c8251175e327d3b856c2e7499573b2e",
          "name": "frontend_product",
          "status": "passed"
        },
        {
          "detail": "github.com/domainry/domainry-identity@v0.999.0-domainry.fb15d48ff343e257",
          "name": "identity_module",
          "status": "passed"
        },
        {
          "detail": "github.com/domainry/domainry-notification@v0.999.0-domainry.6d514eed8de06f7a",
          "name": "notification_module",
          "status": "passed"
        },
        {
          "detail": "github.com/domainry/domainry-notification-sdk@v0.999.0-domainry.277b30b6ab64b6b8",
          "name": "notification_sdk",
          "status": "passed"
        },
        {
          "detail": "domainry-project-delivery-local-development",
          "name": "project_delivery_signer",
          "status": "passed"
        },
        {
          "detail": "available",
          "name": "project_delivery_store",
          "status": "passed"
        },
        {
          "detail": "local.domainry.project-delivery revision 1",
          "name": "project_delivery_trust",
          "status": "passed"
        },
        {
          "detail": "domainry-project-template_v0.3.6-25-m1-report-kind-20260905.tar.gz sha256:9f42f06ff630bd4d7eec330ee1d70e57ca73af98918b4c5029d85d162be4af40",
          "name": "project_template",
          "status": "passed"
        },
        {
          "detail": "domainry-runtime-client-sdk_v0.3.6-25-m1-report-kind-20260905.tar.gz sha256:6a478d047feb0ced5229473d02b55f7bb94677948e8a3233831b1300fdcf5d64",
          "name": "runtime_client_sdk",
          "status": "passed"
        },
        {
          "detail": "runtime-domain-api-v1 + runtime-authoring-v1",
          "name": "runtime_contract",
          "status": "passed"
        },
        {
          "detail": "github.com/domainry/domainry-runtime@v0.0.0-source-7c3926cc4d6d2b22",
          "name": "runtime_module",
          "status": "passed"
        },
        {
          "detail": "1 platforms",
          "name": "skill_packages",
          "status": "passed"
        }
      ]
    }
  },
  "hashes": {
    "candidate_config_sha256": "67cbdfddf7124987f96a669ce0c49005e9517a5f12335909fc1aedc3e0ce65f4",
    "requirements_sha256": "e59edec731f9ff2bcda8a6b928681b273be7873a22c3f9ea93c9bb27e6cea83e",
    "rendered_driver_prompt_sha256": "cb0f798e8ec45b9184d8ed5d972d56c05c2423539189eb8d64cbf22bde5aa772",
    "checker_sha256": "7b75ecf646c7dfc07bb0c51b8730b6fef61d24f45ae77665695b4b1c58832f5f",
    "scorer_sha256": "f57f46b346a969cca87aa691f1e2bad3a6362cf7e6036ab51b7794b7f0117419",
    "frozen_checker_sha256": "7b75ecf646c7dfc07bb0c51b8730b6fef61d24f45ae77665695b4b1c58832f5f",
    "frozen_scorer_sha256": "f57f46b346a969cca87aa691f1e2bad3a6362cf7e6036ab51b7794b7f0117419",
    "driver_sha256": "0934a8a92472f95d6f92a2dcb2b223adebd5aec39e866ed04c36d4e4476750a1",
    "agent_command_sha256": "2b69b6726cf91bdf5612f2507c032f855a182e0a5958ef1700e1ace2cb15f007",
    "checker_command_sha256": "03bb0f85ec953b1bc3b317616e76fe65950acc8de966d5aac01491f1b9229d75"
  },
  "agent_context": {
    "fresh_session_required": true,
    "resume_forbidden": true,
    "codex_home_contents_during_agent": [
      "auth.json",
      "skills/domainry-builder-v1"
    ],
    "ephemeral_auth_staged": true,
    "auth_retention": "remove_immediately_after_agent",
    "environment_policy": "minimal-isolated-v1",
    "prompt_inputs": [
      "requirements",
      "evaluator-owned measured-run policy"
    ],
    "evaluator_assets_exposed": false
  }
}
