{
  "contract_version": "domainry-eval-freeze-manifest-v1",
  "run_id": "m1-crm-v0.3.6-42-m1-role-v28-closure-20260906-ca58c2de45a4-baseline-24",
  "benchmark": "m1-crm",
  "run_kind": "baseline",
  "parent_run_id": null,
  "model": "gpt-5.6-sol",
  "budgets": {
    "wall_clock_seconds": 3600.0,
    "total_tokens": 5000000,
    "cli_invocations": 40,
    "cli_retries": 0
  },
  "absence_proof": {
    "checked_epoch": 1788657388.827233,
    "isolation_root_absent": true,
    "project_absent": true,
    "codex_home_absent": true,
    "agent_home_absent": true,
    "sqlite_database_absent": true,
    "sqlite_wal_absent": true,
    "sqlite_shm_absent": true
  },
  "isolation": {
    "root": "/private/tmp/domainry-m1-v42-role-v28-baseline-24",
    "codex_home": "/private/tmp/domainry-m1-v42-role-v28-baseline-24/codex-home",
    "agent_home": "/private/tmp/domainry-m1-v42-role-v28-baseline-24/home",
    "temp": "/private/tmp/domainry-m1-v42-role-v28-baseline-24/tmp",
    "project": "/private/tmp/domainry-m1-v42-role-v28-baseline-24/project",
    "runtime": "/private/tmp/domainry-m1-v42-role-v28-baseline-24/runtime",
    "database": "/private/tmp/domainry-m1-v42-role-v28-baseline-24/runtime/cohort.sqlite",
    "candidate_copy": "/private/tmp/domainry-m1-v42-role-v28-baseline-24/codex-home/skills/domainry-builder-v1"
  },
  "candidate": {
    "candidate_id": "v0.3.6-42-m1-role-v28-closure-20260906+ca58c2de45a4",
    "skill_name": "domainry-builder-v1",
    "skill_version": "v0.3.6-42-m1-role-v28-closure-20260906",
    "skill_identity_sha256": "ebd64d96025aeabc3ec803e2cef1d6330e670533269edbfc0dda8172909aaceb",
    "package_metadata_sha256": "c6c9da11dfd2a7f24fcb3f9a649d3dff5fed60605a62366b3a449155c385e649",
    "skill_tree_sha256": "ca58c2de45a45a06c24ae802df968e1d318f650713838344d6a13878dead3272",
    "cli_binary_sha256": "0e550f152477a0cf922b7f6316b432226c085936cf162082f10f6f4115372d9f",
    "runtime_api_contract_version": "runtime-domain-api-v1",
    "runtime_api_contract_hash": "4fe655cbfd4fa0bc0b0c04c89b86926fc6aceb059c9fccf5b09eec9b459330f7",
    "apply_target_flag": "--service",
    "apply_target_value": "http://127.0.0.1:8283"
  },
  "isolated_candidate": {
    "candidate_id": "v0.3.6-42-m1-role-v28-closure-20260906+ca58c2de45a4",
    "skill_name": "domainry-builder-v1",
    "skill_version": "v0.3.6-42-m1-role-v28-closure-20260906",
    "skill_identity_sha256": "ebd64d96025aeabc3ec803e2cef1d6330e670533269edbfc0dda8172909aaceb",
    "package_metadata_sha256": "c6c9da11dfd2a7f24fcb3f9a649d3dff5fed60605a62366b3a449155c385e649",
    "skill_tree_sha256": "ca58c2de45a45a06c24ae802df968e1d318f650713838344d6a13878dead3272",
    "cli_binary_sha256": "0e550f152477a0cf922b7f6316b432226c085936cf162082f10f6f4115372d9f",
    "runtime_api_contract_version": "runtime-domain-api-v1",
    "runtime_api_contract_hash": "4fe655cbfd4fa0bc0b0c04c89b86926fc6aceb059c9fccf5b09eec9b459330f7",
    "apply_target_flag": "--service",
    "apply_target_value": "http://127.0.0.1:8283"
  },
  "service_identity": {
    "target_kind": "service",
    "healthy": true,
    "http_status": 200,
    "health_document_sha256": "ff948e5cd9af38cbf539be32d7a9c3d99a791f9bcfdfa2660a4ac628c415c64d",
    "published_identity": {
      "contract_version": "domainry-control-plane-health-v1",
      "discovery": "/.well-known/domainry-plane",
      "service_kind": "template-control-plane",
      "version": "v0.3.6-42-m1-role-v28-closure-20260906",
      "checks": [
        {
          "detail": "v0.3.6-42-m1-role-v28-closure-20260906",
          "name": "application_delivery",
          "status": "passed"
        },
        {
          "detail": "domainry-frontend-product_v0.3.6-42-m1-role-v28-closure-20260906.tar.gz sha256:07c9c363720ebae52d114ee59a13d30e8a66a62e77cdfaf64a52510bf0a1acb9",
          "name": "frontend_product",
          "status": "passed"
        },
        {
          "detail": "github.com/domainry/domainry-identity@v0.999.0-domainry.64eecbefe4c7666d",
          "name": "identity_module",
          "status": "passed"
        },
        {
          "detail": "github.com/domainry/domainry-notification@v0.999.0-domainry.f56d7f148b817b7a",
          "name": "notification_module",
          "status": "passed"
        },
        {
          "detail": "github.com/domainry/domainry-notification-sdk@v0.999.0-domainry.d7ebf4fd5998376a",
          "name": "notification_sdk",
          "status": "passed"
        },
        {
          "detail": "domainry-project-delivery-local-development",
          "name": "project_delivery_signer",
          "status": "passed"
        },
        {
          "detail": "available",
          "name": "project_delivery_store",
          "status": "passed"
        },
        {
          "detail": "local.domainry.project-delivery revision 1",
          "name": "project_delivery_trust",
          "status": "passed"
        },
        {
          "detail": "domainry-project-template_v0.3.6-42-m1-role-v28-closure-20260906.tar.gz sha256:9f42f06ff630bd4d7eec330ee1d70e57ca73af98918b4c5029d85d162be4af40",
          "name": "project_template",
          "status": "passed"
        },
        {
          "detail": "domainry-runtime-client-sdk_v0.3.6-42-m1-role-v28-closure-20260906.tar.gz sha256:7a86bfc5a252cf12d26ce518927bf76994c948b08a5a30da4b89ce3304b4b8ac",
          "name": "runtime_client_sdk",
          "status": "passed"
        },
        {
          "detail": "runtime-domain-api-v1 + runtime-authoring-v1",
          "name": "runtime_contract",
          "status": "passed"
        },
        {
          "detail": "github.com/domainry/domainry-runtime@v0.0.0-source-f30da554e3788ffe",
          "name": "runtime_module",
          "status": "passed"
        },
        {
          "detail": "1 platforms",
          "name": "skill_packages",
          "status": "passed"
        }
      ]
    }
  },
  "hashes": {
    "candidate_config_sha256": "67cbdfddf7124987f96a669ce0c49005e9517a5f12335909fc1aedc3e0ce65f4",
    "requirements_sha256": "e59edec731f9ff2bcda8a6b928681b273be7873a22c3f9ea93c9bb27e6cea83e",
    "rendered_driver_prompt_sha256": "cb0f798e8ec45b9184d8ed5d972d56c05c2423539189eb8d64cbf22bde5aa772",
    "checker_sha256": "7b75ecf646c7dfc07bb0c51b8730b6fef61d24f45ae77665695b4b1c58832f5f",
    "scorer_sha256": "0e644d6d485c0e6e6a06cab87a8479c6f26bc5c23cfda8cfe9b3b656aa7a6afd",
    "frozen_checker_sha256": "7b75ecf646c7dfc07bb0c51b8730b6fef61d24f45ae77665695b4b1c58832f5f",
    "frozen_scorer_sha256": "0e644d6d485c0e6e6a06cab87a8479c6f26bc5c23cfda8cfe9b3b656aa7a6afd",
    "driver_sha256": "d8107e915a5291e77607486c7ff2bf7c96605bb4c2ace22c022f29342bae7102",
    "agent_command_sha256": "35a6e26632c6a1ffd90135372680e41a1501e379b50cbfd0017d60e6a3976ef1",
    "checker_command_sha256": "03bb0f85ec953b1bc3b317616e76fe65950acc8de966d5aac01491f1b9229d75"
  },
  "agent_context": {
    "fresh_session_required": true,
    "resume_forbidden": true,
    "codex_home_contents_during_agent": [
      "auth.json",
      "skills/domainry-builder-v1"
    ],
    "ephemeral_auth_staged": true,
    "auth_retention": "remove_immediately_after_agent",
    "environment_policy": "minimal-isolated-v1",
    "prompt_inputs": [
      "requirements",
      "evaluator-owned measured-run policy"
    ],
    "evaluator_assets_exposed": false
  }
}
